{
  "$schema": "https://json-schema.org/draft/2020-12/schema",
  "$id": "https://rewireperform.local/contracts/feedback-intelligence/combined-staging-postdeploy-v0.2/evidence.schema.json",
  "title": "Feedback Intelligence v0.3.3 combined Staging postdeploy evidence v0.2",
  "type": "object",
  "additionalProperties": false,
  "required": [
    "schema_version",
    "evidence_status",
    "target",
    "producer_basis",
    "accepted_predeploy",
    "remote_registry_migration",
    "database_assurance",
    "runtime_assurance",
    "edge_assurance",
    "historical_evidence",
    "gates",
    "next_gate"
  ],
  "properties": {
    "schema_version": {
      "const": "rewireperform-feedback-intelligence-combined-staging-postdeploy-v2"
    },
    "evidence_status": {
      "const": "PASS_V0_3_3_POSTDEPLOY_ASSURANCE_UNSIGNED_AWAITING_CONSUMER_REVIEW"
    },
    "target": {
      "type": "object",
      "additionalProperties": false,
      "required": ["project_ref", "environment", "region", "jurisdiction", "data_scope"],
      "properties": {
        "project_ref": { "const": "zbeswjipayspgvcipzmx" },
        "environment": { "const": "staging" },
        "region": { "const": "eu-central-1" },
        "jurisdiction": { "const": "DE" },
        "data_scope": { "const": "synthetic_only" }
      }
    },
    "producer_basis": {
      "type": "object",
      "additionalProperties": false,
      "required": ["apple_rc_commit", "predeploy_integration_commit", "repository_state"],
      "properties": {
        "apple_rc_commit": { "const": "f23aac2d1dd27d9f9bbcce2c690f7c14478d6969" },
        "predeploy_integration_commit": { "const": "0a459a511d5271597294c0d926e05568ccaabbef" },
        "repository_state": { "const": "PINNED_COMMITTED_INPUTS" }
      }
    },
    "accepted_predeploy": {
      "type": "object",
      "additionalProperties": false,
      "required": [
        "evidence_sha256",
        "manifest_sha256",
        "package_sha256",
        "consumer_commit",
        "consumer_acceptance_sha256"
      ],
      "properties": {
        "evidence_sha256": { "const": "c7beb25bc3af8278835029aa9bc1b6cdd78d598969f2eac7757da7cee8e97984" },
        "manifest_sha256": { "const": "a39a0836dcfdd8b93e7ab785f056c8946a8b59ebed1220c32197a31675fb8cfa" },
        "package_sha256": { "const": "ce262b8af6cef042e82ada1b1ddd5f54262dbaa0b621908b58eabf3735d4f2dc" },
        "consumer_commit": { "const": "59e84cb70f07cb2e51c09e267d2d209aaf805421" },
        "consumer_acceptance_sha256": { "const": "cf352c7af509cd3ff1b61039e1437059d574697713e05b30e0cfa0224013554d" }
      }
    },
    "remote_registry_migration": {
      "type": "object",
      "additionalProperties": false,
      "required": ["remote_version", "name", "local_path", "local_sha256", "applied"],
      "properties": {
        "remote_version": { "const": "20260810183222" },
        "name": { "const": "feedback_intelligence_visualization_copy_v1_1_2" },
        "local_path": { "const": "supabase/migrations/20260810154932_feedback_intelligence_visualization_copy_v1_1_2.sql" },
        "local_sha256": { "const": "d7160cb28eb64529ba95fe4c9d47ceab352dc194cc105b6194670a9479a265a9" },
        "applied": { "const": true }
      }
    },
    "database_assurance": {
      "type": "object",
      "additionalProperties": false,
      "required": [
        "executed_at",
        "audit_phase",
        "audit_result_path",
        "audit_result_sha256",
        "audit_sql_sha256",
        "application_rows_read",
        "application_functions_called",
        "database_mutated",
        "draft_campaigns",
        "reader_direct_relation_privileges",
        "reader_direct_sequence_privileges",
        "reader_callable_function_count",
        "gateway_execute_matrix",
        "public_execute_default_count"
      ],
      "properties": {
        "executed_at": { "const": "2026-08-10T18:33:18.574371+00:00" },
        "audit_phase": { "const": "POSTDEPLOY_ASSURANCE" },
        "audit_result_path": { "const": "docs/feedback-intelligence/contracts/combined-staging-postdeploy-v0.2/remote-audit-result-2026-08-10-v0-3-3.json" },
        "audit_result_sha256": { "$ref": "#/$defs/sha256" },
        "audit_sql_sha256": { "const": "7f7865f769f46bfab204c37d071ee743636fe183f6d6876a24557e51dc508bd3" },
        "application_rows_read": { "const": false },
        "application_functions_called": { "const": false },
        "database_mutated": { "const": false },
        "draft_campaigns": {
          "type": "array",
          "minItems": 4,
          "maxItems": 4,
          "items": { "$ref": "#/$defs/draftCampaign" }
        },
        "reader_direct_relation_privileges": { "const": 0 },
        "reader_direct_sequence_privileges": { "const": 0 },
        "reader_callable_function_count": { "const": 1 },
        "gateway_execute_matrix": {
          "type": "object",
          "additionalProperties": false,
          "required": ["anon", "authenticated", "service_role", "mahleos_feedback_reader"],
          "properties": {
            "anon": { "const": false },
            "authenticated": { "const": false },
            "service_role": { "const": false },
            "mahleos_feedback_reader": { "const": true }
          }
        },
        "public_execute_default_count": { "const": 0 }
      }
    },
    "runtime_assurance": {
      "type": "object",
      "additionalProperties": false,
      "required": [
        "export_manifest_sha256",
        "export_package_sha256",
        "export_schema_sha256",
        "gateway_request_schema_sha256",
        "gateway_definition_sha256",
        "internal_export_definition_sha256",
        "export_unchanged",
        "request_schema_unchanged",
        "gateway_definition_unchanged",
        "internal_export_definition_unchanged"
      ],
      "properties": {
        "export_manifest_sha256": { "const": "89298e177f65a7f517e9cc930c0dc9e0af588875117bf4449e7898200e31dfab" },
        "export_package_sha256": { "const": "8c1bd5807865c41c7572ddd47872bca355515f99a4f7ef1f17a017d1bd35794b" },
        "export_schema_sha256": { "const": "e90eb3fc2ce717ef91ae35bcfcd5bc7944d3cc941faa8f071b42e934e967023d" },
        "gateway_request_schema_sha256": { "const": "74e3616a67975766b51238d5573671d8e086014392d0e59e3ee9696ab287d204" },
        "gateway_definition_sha256": { "const": "d08d3fbf17420570ad6e8f29f0e3e19717a874f19a767c8eb7c7656acf7aedfd" },
        "internal_export_definition_sha256": { "const": "534d0d8770899566658b7efb68c6bc31cfecc068dcf5cf94c30f09143b2ab043" },
        "export_unchanged": { "const": true },
        "request_schema_unchanged": { "const": true },
        "gateway_definition_unchanged": { "const": true },
        "internal_export_definition_unchanged": { "const": true }
      }
    },
    "edge_assurance": {
      "type": "object",
      "additionalProperties": false,
      "required": [
        "slug",
        "observed_version",
        "status",
        "source_sha256",
        "source_manifest_sha256",
        "source_unchanged",
        "redeployed_for_v0_3_3"
      ],
      "properties": {
        "slug": { "const": "mahleos-feedback-intelligence-read" },
        "observed_version": { "const": 25 },
        "status": { "const": "ACTIVE" },
        "source_sha256": { "const": "b1e1cf077970011f6f62beef121ec617c94a4f37849163958bc1a2840199c384" },
        "source_manifest_sha256": { "const": "cd76527cbe5bd3accfc7b64c8860b2ad5a11042bcecb2f5b4722510255f2eb6a" },
        "source_unchanged": { "const": true },
        "redeployed_for_v0_3_3": { "const": false }
      }
    },
    "historical_evidence": {
      "type": "object",
      "additionalProperties": false,
      "required": ["v0_3_2_authorizes_v0_3_3", "silent_reinterpretation_allowed", "historical_bytes_preserved"],
      "properties": {
        "v0_3_2_authorizes_v0_3_3": { "const": false },
        "silent_reinterpretation_allowed": { "const": false },
        "historical_bytes_preserved": { "const": true }
      }
    },
    "gates": {
      "type": "object",
      "additionalProperties": false,
      "required": [
        "feedback_collection_enabled",
        "text_collection_enabled",
        "minor_policy_enabled",
        "guardian_policy_enabled",
        "consumer_pin_enabled",
        "synthetic_export_enabled",
        "reader_password_provisioned_by_this_gate",
        "machine_key_provisioned_by_this_gate",
        "credential_mutation_performed",
        "network_read_performed",
        "export_function_called",
        "production_export_enabled",
        "real_data_read_enabled",
        "additional_database_write_performed",
        "edge_deploy_performed",
        "push_performed",
        "merge_performed",
        "app_store_release_authorized"
      ],
      "properties": {
        "feedback_collection_enabled": { "const": false },
        "text_collection_enabled": { "const": false },
        "minor_policy_enabled": { "const": false },
        "guardian_policy_enabled": { "const": false },
        "consumer_pin_enabled": { "const": false },
        "synthetic_export_enabled": { "const": false },
        "reader_password_provisioned_by_this_gate": { "const": false },
        "machine_key_provisioned_by_this_gate": { "const": false },
        "credential_mutation_performed": { "const": false },
        "network_read_performed": { "const": false },
        "export_function_called": { "const": false },
        "production_export_enabled": { "const": false },
        "real_data_read_enabled": { "const": false },
        "additional_database_write_performed": { "const": false },
        "edge_deploy_performed": { "const": false },
        "push_performed": { "const": false },
        "merge_performed": { "const": false },
        "app_store_release_authorized": { "const": false }
      }
    },
    "next_gate": {
      "type": "object",
      "additionalProperties": false,
      "required": ["decision", "consumer_review_required", "credentials_allowed", "network_read_allowed", "production_allowed"],
      "properties": {
        "decision": { "const": "AWAITING_JARVIS_V0_3_3_POSTDEPLOY_REVIEW" },
        "consumer_review_required": { "const": true },
        "credentials_allowed": { "const": false },
        "network_read_allowed": { "const": false },
        "production_allowed": { "const": false }
      }
    }
  },
  "$defs": {
    "sha256": {
      "type": "string",
      "pattern": "^[0-9a-f]{64}$"
    },
    "draftCampaign": {
      "type": "object",
      "additionalProperties": false,
      "required": ["campaign_reference", "content_version", "questionnaire_version", "questionnaire_manifest_hash", "status"],
      "properties": {
        "campaign_reference": { "type": "string", "pattern": "^feedback-day-(10|24|39|55)-v1$" },
        "content_version": { "const": "feedback-intelligence-content-v1.1.2" },
        "questionnaire_version": { "type": "string", "pattern": "^feedback-d(10|24|39|55)-v1\\.1\\.2$" },
        "questionnaire_manifest_hash": { "$ref": "#/$defs/sha256" },
        "status": { "const": "draft" }
      }
    }
  }
}
